{
  "returnValue": true,
  "valueList": "107888;107889;21212;73496;100093;114211;114213;113566;113568;113570;106657;118806;121400;29024;30697;49377;101904;68070;75511;107576;107577;122187;68081;115731;67983;67986;21213;45740;63214;21484;107246;107247;32781;24028;69874;50770;106580;123925;",
  "dataSource": 1,
  "dataType": 2,
  "cableAnalogSkipped": false,
  "scannedChannelCount": {
    "terrestrialAnalogCount": 0,
    "terrestrialDigitalCount": 38,
    "cableAnalogCount": 0,
    "cableDigitalCount": 0,
    "satelliteDigitalCount": 0
  },
  "deviceSourceIndex": 1,
  "channelListCount": 38,
  "channelLogoServerUrl": "http://aic-ngfts.lge.com/fts/gftsDownload.lge?biz_code=IBS&func_code=TMS_CHANNEL_IMG_US&file_path=/ibs/tms/channel_img_us",
  "ipChanInteractiveUrl": "",
  "channelList": [
    {
      "channelId": "1_33_3_1_0_0_0",
      "programId": "1_33_3_1_0_0_0",
      "signalChannelId": "1_33_3_1_0_0_0",
      "chanCode": "107888",
      "channelMode": "Terrestrial",
      "channelModeId": 0,
      "channelType": "Terrestrial Digital TV",
      "channelTypeId": 1,
      "channelNumber": "3-1",
      "majorNumber": 3,
      "minorNumber": 1,
      "channelName": "XHCTTI",
      "skipped": false,
      "locked": false,
      "descrambled": true,
      "scrambled": false,
      "serviceType": 2,
      "favoriteGroup": [],
      "imgUrl": "",
      "display": 1,
      "satelliteName": " ",
      "fineTuned": false,
      "Frequency": 0,
      "shortCut": 0,
      "Bandwidth": 0,
      "HDTV": false,
      "Invisible": false,
      "TV": true,
      "DTV": true,
      "ATV": false,
      "Data": false,
      "Radio": false,
      "Numeric": false,
      "PrimaryCh": true,
      "specialService": false,
      "CASystemIDList": {},
      "CASystemIDListCount": 0,
      "groupIdList": [0],
      "channelGenreCode": "61",
      "favoriteIdxA": 250,
      "favoriteIdxB": 250,
      "favoriteIdxC": 250,
      "favoriteIdxD": 250,
      "imgUrl2": "",
      "channelLogoSize": "",
      "ipChanServerUrl": "",
      "payChan": false,
      "IPChannelCode": "",
      "ipCallNumber": "",
      "otuFlag": false,
      "favoriteIdxE": 250,
      "favoriteIdxF": 250,
      "favoriteIdxG": 250,
      "favoriteIdxH": 250,
      "satelliteLcn": false,
      "waterMarkUrl": "",
      "channelNameSortKey": "",
      "ipChanType": "",
      "adultFlag": 0,
      "ipChanCategory": "",
      "ipChanInteractive": false,
      "callSign": "UNKNOWN",
      "adFlag": 0,
      "configured": false,
      "lastUpdated": "",
      "ipChanCpId": "",
      "isFreeviewPlay": 1,
      "playerService": "com.webos.service.tv",
      "TSID": 0,
      "SVCID": 0
    },
    {
      "channelId": "1_33_3_4_0_0_0",
      "programId": "1_33_3_4_0_0_0",
      "signalChannelId": "1_33_3_4_0_0_0",
      "chanCode": "107889",
      "channelMode": "Terrestrial",
      "channelModeId": 0,
      "channelType": "Terrestrial Digital TV",
      "channelTypeId": 1,
      "channelNumber": "3-4",
      "majorNumber": 3,
      "minorNumber": 4,
      "channelName": "XHCTTI",
      "skipped": false,
      "locked": false,
      "descrambled": true,
      "scrambled": false,
      "serviceType": 2,
      "favoriteGroup": [],
      "imgUrl": "",
      "display": 1,
      "satelliteName": " ",
      "fineTuned": false,
      "Frequency": 0,
      "shortCut": 0,
      "Bandwidth": 0,
      "HDTV": false,
      "Invisible": false,
      "TV": true,
      "DTV": true,
      "ATV": false,
      "Data": false,
      "Radio": false,
      "Numeric": false,
      "PrimaryCh": true,
      "specialService": false,
      "CASystemIDList": {},
      "CASystemIDListCount": 0,
      "groupIdList": [0],
      "channelGenreCode": "61",
      "favoriteIdxA": 250,
      "favoriteIdxB": 250,
      "favoriteIdxC": 250,
      "favoriteIdxD": 250,
      "imgUrl2": "",
      "channelLogoSize": "",
      "ipChanServerUrl": "",
      "payChan": false,
      "IPChannelCode": "",
      "ipCallNumber": "",
      "otuFlag": false,
      "favoriteIdxE": 250,
      "favoriteIdxF": 250,
      "favoriteIdxG": 250,
      "favoriteIdxH": 250,
      "satelliteLcn": false,
      "waterMarkUrl": "",
      "channelNameSortKey": "",
      "ipChanType": "",
      "adultFlag": 0,
      "ipChanCategory": "",
      "ipChanInteractive": false,
      "callSign": "UNKNOWN",
      "adFlag": 0,
      "configured": false,
      "lastUpdated": "",
      "ipChanCpId": "",
      "isFreeviewPlay": 1,
      "playerService": "com.webos.service.tv",
      "TSID": 0,
      "SVCID": 0
    },
    {
      "channelId": "1_8_8_1_0_0_0",
      "programId": "1_8_8_1_0_0_0",
      "signalChannelId": "1_8_8_1_0_0_0",
      "chanCode": "21212",
      "channelMode": "Terrestrial",
      "channelModeId": 0,
      "channelType": "Terrestrial Digital TV",
      "channelTypeId": 1,
      "channelNumber": "8-1",
      "majorNumber": 8,
      "minorNumber": 1,
      "channelName": "KFMB-HD",
      "skipped": false,
      "locked": false,
      "descrambled": true,
      "scrambled": false,
      "serviceType": 2,
      "favoriteGroup": [],
      "imgUrl": "",
      "display": 1,
      "satelliteName": " ",
      "fineTuned": false,
      "Frequency": 0,
      "shortCut": 0,
      "Bandwidth": 0,
      "HDTV": false,
      "Invisible": false,
      "TV": true,
      "DTV": true,
      "ATV": false,
      "Data": false,
      "Radio": false,
      "Numeric": false,
      "PrimaryCh": true,
      "specialService": false,
      "CASystemIDList": {},
      "CASystemIDListCount": 0,
      "groupIdList": [0],
      "channelGenreCode": "59",
      "favoriteIdxA": 250,
      "favoriteIdxB": 250,
      "favoriteIdxC": 250,
      "favoriteIdxD": 250,
      "imgUrl2": "",
      "channelLogoSize": "",
      "ipChanServerUrl": "",
      "payChan": false,
      "IPChannelCode": "",
      "ipCallNumber": "",
      "otuFlag": false,
      "favoriteIdxE": 250,
      "favoriteIdxF": 250,
      "favoriteIdxG": 250,
      "favoriteIdxH": 250,
      "satelliteLcn": false,
      "waterMarkUrl": "",
      "channelNameSortKey": "",
      "ipChanType": "",
      "adultFlag": 0,
      "ipChanCategory": "",
      "ipChanInteractive": false,
      "callSign": "UNKNOWN",
      "adFlag": 0,
      "configured": false,
      "lastUpdated": "",
      "ipChanCpId": "",
      "isFreeviewPlay": 1,
      "playerService": "com.webos.service.tv",
      "TSID": 0,
      "SVCID": 0
    },
    {
      "channelId": "1_8_8_2_0_0_0",
      "programId": "1_8_8_2_0_0_0",
      "signalChannelId": "1_8_8_2_0_0_0",
      "chanCode": "73496",
      "channelMode": "Terrestrial",
      "channelModeId": 0,
      "channelType": "Terrestrial Digital TV",
      "channelTypeId": 1,
      "channelNumber": "8-2",
      "majorNumber": 8,
      "minorNumber": 2,
      "channelName": "KFMB-CW",
      "skipped": false,
      "locked": false,
      "descrambled": true,
      "scrambled": false,
      "serviceType": 2,
      "favoriteGroup": [],
      "imgUrl": "/mnt/lg/cmn_data/channel_logo/minor_logo_img/73496_202003020000_h180x135.png",
      "display": 1,
      "satelliteName": " ",
      "fineTuned": false,
      "Frequency": 0,
      "shortCut": 0,
      "Bandwidth": 0,
      "HDTV": false,
      "Invisible": false,
      "TV": true,
      "DTV": true,
      "ATV": false,
      "Data": false,
      "Radio": false,
      "Numeric": false,
      "PrimaryCh": true,
      "specialService": false,
      "CASystemIDList": {},
      "CASystemIDListCount": 0,
      "groupIdList": [0],
      "channelGenreCode": "2",
      "favoriteIdxA": 250,
      "favoriteIdxB": 250,
      "favoriteIdxC": 250,
      "favoriteIdxD": 250,
      "imgUrl2": "",
      "channelLogoSize": "H180x135",
      "ipChanServerUrl": "",
      "payChan": false,
      "IPChannelCode": "",
      "ipCallNumber": "",
      "otuFlag": false,
      "favoriteIdxE": 250,
      "favoriteIdxF": 250,
      "favoriteIdxG": 250,
      "favoriteIdxH": 250,
      "satelliteLcn": false,
      "waterMarkUrl": "",
      "channelNameSortKey": "",
      "ipChanType": "",
      "adultFlag": 0,
      "ipChanCategory": "",
      "ipChanInteractive": false,
      "callSign": "UNKNOWN",
      "adFlag": 0,
      "configured": false,
      "lastUpdated": "",
      "ipChanCpId": "",
      "isFreeviewPlay": 1,
      "playerService": "com.webos.service.tv",
      "TSID": 0,
      "SVCID": 0
    },
    {
      "channelId": "1_8_8_3_0_0_0",
      "programId": "1_8_8_3_0_0_0",
      "signalChannelId": "1_8_8_3_0_0_0",
      "chanCode": "100093",
      "channelMode": "Terrestrial",
      "channelModeId": 0,
      "channelType": "Terrestrial Digital TV",
      "channelTypeId": 1,
      "channelNumber": "8-3",
      "majorNumber": 8,
      "minorNumber": 3,
      "channelName": "Laff",
      "skipped": false,
      "locked": false,
      "descrambled": true,
      "scrambled": false,
      "serviceType": 2,
      "favoriteGroup": [],
      "imgUrl": "",
      "display": 1,
      "satelliteName": " ",
      "fineTuned": false,
      "Frequency": 0,
      "shortCut": 0,
      "Bandwidth": 0,
      "HDTV": false,
      "Invisible": false,
      "TV": true,
      "DTV": true,
      "ATV": false,
      "Data": false,
      "Radio": false,
      "Numeric": false,
      "PrimaryCh": true,
      "specialService": false,
      "CASystemIDList": {},
      "CASystemIDListCount": 0,
      "groupIdList": [0],
      "channelGenreCode": "2",
      "favoriteIdxA": 250,
      "favoriteIdxB": 250,
      "favoriteIdxC": 250,
      "favoriteIdxD": 250,
      "imgUrl2": "",
      "channelLogoSize": "",
      "ipChanServerUrl": "",
      "payChan": false,
      "IPChannelCode": "",
      "ipCallNumber": "",
      "otuFlag": false,
      "favoriteIdxE": 250,
      "favoriteIdxF": 250,
      "favoriteIdxG": 250,
      "favoriteIdxH": 250,
      "satelliteLcn": false,
      "waterMarkUrl": "",
      "channelNameSortKey": "",
      "ipChanType": "",
      "adultFlag": 0,
      "ipChanCategory": "",